{
  "id": "h",
  "name": "H",
  "version": 1,
  "nodes": [
    { "id": "l0", "x": 0.2, "y": 0.15 },
    { "id": "l1", "x": 0.2, "y": 0.38 },
    { "id": "l2", "x": 0.2, "y": 0.62 },
    { "id": "l3", "x": 0.2, "y": 0.85 },
    { "id": "r0", "x": 0.8, "y": 0.15 },
    { "id": "r1", "x": 0.8, "y": 0.38 },
    { "id": "r2", "x": 0.8, "y": 0.62 },
    { "id": "r3", "x": 0.8, "y": 0.85 },
    { "id": "m0", "x": 0.4, "y": 0.5 },
    { "id": "c", "x": 0.5, "y": 0.5 },
    { "id": "m1", "x": 0.6, "y": 0.5 },
    { "id": "x0", "x": 0.5, "y": 0.2 },
    { "id": "x1", "x": 0.5, "y": 0.8 }
  ],
  "edges": [
    ["l0", "l1"],
    ["l1", "l2"],
    ["l2", "l3"],
    ["r0", "r1"],
    ["r1", "r2"],
    ["r2", "r3"],
    ["l1", "m0"],
    ["c", "m0"],
    ["c", "m1"],
    ["m1", "r1"],
    ["l2", "m0"],
    ["m1", "r2"],
    ["c", "x0"],
    ["c", "x1"]
  ],
  "lockedNodes": ["x0", "x1"],
  "keyNodes": ["c"]
}
